{
  "$schema": "http://json-schema.org/draft-07/schema#",
  "title": "Feature",
  "description": "A life-as-code feature document that captures the full lifecycle of a product/engineering feature, from problem statement through decisions, implementation, and annotations.",
  "type": "object",
  "required": ["featureKey", "title", "status", "problem"],
  "additionalProperties": false,
  "properties": {
    "featureKey": {
      "type": "string",
      "description": "Unique identifier for this feature. Auto-generated by lac-cli.",
      "pattern": "^[a-z][a-z0-9]*-\\d{4}-\\d{3}$",
      "examples": ["feat-2026-001", "proc-2026-001", "goal-2026-001"]
    },
    "title": {
      "type": "string",
      "description": "Short human-readable title for this feature.",
      "minLength": 1,
      "examples": ["User Authentication", "Dark Mode Support"]
    },
    "status": {
      "type": "string",
      "description": "Current lifecycle status of the feature.",
      "enum": ["draft", "active", "frozen", "deprecated"]
    },
    "problem": {
      "type": "string",
      "description": "The human problem this feature solves. Written from the user's perspective.",
      "minLength": 1,
      "examples": ["Users need a secure way to log in and manage their accounts."]
    },
    "analysis": {
      "type": "string",
      "description": "Free-form analysis of the problem space, research findings, or prior art."
    },
    "decisions": {
      "type": "array",
      "description": "Architectural or design decisions made during the development of this feature.",
      "items": {
        "$ref": "#/definitions/Decision"
      }
    },
    "implementation": {
      "type": "string",
      "description": "Implementation notes, approach summary, or links to relevant code."
    },
    "knownLimitations": {
      "type": "array",
      "description": "Known limitations, trade-offs, or tech debt introduced by this feature.",
      "items": {
        "type": "string",
        "minLength": 1
      }
    },
    "tags": {
      "type": "array",
      "description": "Free-form tags for search and categorisation.",
      "items": {
        "type": "string",
        "minLength": 1
      },
      "examples": [["auth", "security", "backend"]]
    },
    "annotations": {
      "type": "array",
      "description": "Time-stamped annotations attached to this feature by team members.",
      "items": {
        "$ref": "#/definitions/Annotation"
      }
    },
    "schemaVersion": {
      "type": "integer",
      "description": "Schema version number for future migration tooling. When absent, tools assume version 1.",
      "minimum": 1,
      "examples": [1]
    },
    "owner": {
      "type": "string",
      "description": "The person or team responsible for this feature.",
      "examples": ["marc", "team-auth", "alice@example.com"]
    },
    "lineage": {
      "$ref": "#/definitions/Lineage"
    },
    "successCriteria": {
      "type": "string",
      "description": "Plain-language definition of done for this feature."
    },
    "domain": {
      "type": "string",
      "description": "Free-form domain tag, e.g. \"auth\", \"payments\"."
    },
    "priority": {
      "type": "integer",
      "description": "Priority level 1–5 (1 = highest). Controls sibling ordering.",
      "minimum": 1,
      "maximum": 5
    },
    "statusHistory": {
      "type": "array",
      "description": "Append-only log of status transitions.",
      "items": {
        "$ref": "#/definitions/StatusTransition"
      }
    },
    "revisions": {
      "type": "array",
      "description": "Append-only log of intent-critical field changes with author and reason.",
      "items": {
        "$ref": "#/definitions/Revision"
      }
    },
    "superseded_by": {
      "type": "string",
      "description": "featureKey of the feature that supersedes this one.",
      "pattern": "^[a-z][a-z0-9]*-\\d{4}-\\d{3}$"
    },
    "superseded_from": {
      "type": "array",
      "description": "featureKeys of features that this one supersedes.",
      "items": {
        "type": "string",
        "pattern": "^[a-z][a-z0-9]*-\\d{4}-\\d{3}$"
      }
    },
    "merged_into": {
      "type": "string",
      "description": "featureKey of the feature this one was merged into.",
      "pattern": "^[a-z][a-z0-9]*-\\d{4}-\\d{3}$"
    },
    "merged_from": {
      "type": "array",
      "description": "featureKeys of features that were merged into this one.",
      "items": {
        "type": "string",
        "pattern": "^[a-z][a-z0-9]*-\\d{4}-\\d{3}$"
      }
    },
    "componentFile": {
      "type": "string",
      "description": "Relative path to the primary source file that implements this feature, e.g. \"src/components/FeatureCard.tsx\"."
    },
    "npmPackages": {
      "type": "array",
      "description": "npm packages this feature directly depends on at runtime.",
      "items": { "type": "string" }
    },
    "publicInterface": {
      "type": "array",
      "description": "Exported props, function signatures, or API surface that consumers of this feature depend on.",
      "items": { "$ref": "#/definitions/PublicInterfaceEntry" }
    },
    "externalDependencies": {
      "type": "array",
      "description": "Cross-feature runtime dependencies not captured by lineage — featureKeys or relative file paths.",
      "items": { "type": "string" }
    },
    "lastVerifiedDate": {
      "type": "string",
      "description": "YYYY-MM-DD date when this feature.json was last confirmed accurate.",
      "pattern": "^\\d{4}-\\d{2}-\\d{2}$"
    },
    "codeSnippets": {
      "type": "array",
      "description": "Critical one-liners worth preserving verbatim — glob patterns, API calls, architectural pivots.",
      "items": { "$ref": "#/definitions/CodeSnippet" }
    }
  },
  "definitions": {
    "Decision": {
      "type": "object",
      "required": ["decision", "rationale"],
      "additionalProperties": false,
      "properties": {
        "decision": {
          "type": "string",
          "description": "What was decided.",
          "minLength": 1
        },
        "rationale": {
          "type": "string",
          "description": "Why this decision was made.",
          "minLength": 1
        },
        "alternativesConsidered": {
          "type": "array",
          "description": "Other options that were evaluated but not chosen.",
          "items": {
            "type": "string"
          }
        },
        "date": {
          "type": "string",
          "description": "ISO 8601 date when this decision was recorded (YYYY-MM-DD).",
          "pattern": "^\\d{4}-\\d{2}-\\d{2}$",
          "examples": ["2026-03-15"]
        }
      }
    },
    "Annotation": {
      "type": "object",
      "required": ["id", "author", "date", "type", "body"],
      "additionalProperties": false,
      "properties": {
        "id": {
          "type": "string",
          "description": "Unique identifier for this annotation.",
          "minLength": 1
        },
        "author": {
          "type": "string",
          "description": "Name or identifier of the person who wrote this annotation.",
          "minLength": 1
        },
        "date": {
          "type": "string",
          "description": "ISO 8601 date string when this annotation was created.",
          "examples": ["2026-03-15"]
        },
        "type": {
          "type": "string",
          "description": "Category of annotation.",
          "enum": ["decision", "warning", "assumption", "lesson", "breaking-change", "question", "tech-debt"]
        },
        "body": {
          "type": "string",
          "description": "The annotation content.",
          "minLength": 1
        }
      }
    },
    "StatusTransition": {
      "type": "object",
      "required": ["from", "to", "date"],
      "additionalProperties": false,
      "properties": {
        "from": {
          "type": "string",
          "enum": ["draft", "active", "frozen", "deprecated"]
        },
        "to": {
          "type": "string",
          "enum": ["draft", "active", "frozen", "deprecated"]
        },
        "date": {
          "type": "string",
          "pattern": "^\\d{4}-\\d{2}-\\d{2}$"
        },
        "reason": {
          "type": "string"
        }
      }
    },
    "Revision": {
      "type": "object",
      "required": ["date", "author", "fields_changed", "reason"],
      "additionalProperties": false,
      "properties": {
        "date": {
          "type": "string",
          "description": "ISO 8601 date when this revision was recorded (YYYY-MM-DD).",
          "pattern": "^\\d{4}-\\d{2}-\\d{2}$"
        },
        "author": {
          "type": "string",
          "description": "Who made the change.",
          "minLength": 1
        },
        "fields_changed": {
          "type": "array",
          "description": "Which intent-critical fields were changed.",
          "items": { "type": "string" },
          "minItems": 1
        },
        "reason": {
          "type": "string",
          "description": "Why these fields were changed.",
          "minLength": 1
        }
      }
    },
    "PublicInterfaceEntry": {
      "type": "object",
      "required": ["name", "type"],
      "additionalProperties": false,
      "properties": {
        "name": {
          "type": "string",
          "description": "Prop, function, or export name.",
          "minLength": 1
        },
        "type": {
          "type": "string",
          "description": "TypeScript type signature.",
          "minLength": 1
        },
        "description": {
          "type": "string",
          "description": "What this export does or when to use it."
        }
      }
    },
    "CodeSnippet": {
      "type": "object",
      "required": ["label", "snippet"],
      "additionalProperties": false,
      "properties": {
        "label": {
          "type": "string",
          "description": "Short human label, e.g. \"glob pattern\", \"API call\".",
          "minLength": 1
        },
        "snippet": {
          "type": "string",
          "description": "The actual one-liner or short code block to preserve verbatim.",
          "minLength": 1
        }
      }
    },
    "Lineage": {
      "type": "object",
      "description": "Parent/child relationships between features (e.g. spawned sub-features).",
      "additionalProperties": false,
      "properties": {
        "parent": {
          "oneOf": [
            {
              "type": "string",
              "pattern": "^[a-z][a-z0-9]*-\\d{4}-\\d{3}$",
              "description": "featureKey of the parent feature."
            },
            { "type": "null" }
          ]
        },
        "children": {
          "type": "array",
          "description": "featureKeys of child features spawned from this one.",
          "items": {
            "type": "string",
            "pattern": "^[a-z][a-z0-9]*-\\d{4}-\\d{3}$"
          }
        },
        "spawnReason": {
          "oneOf": [
            {
              "type": "string",
              "description": "Why this feature was spawned from its parent."
            },
            { "type": "null" }
          ]
        }
      }
    }
  }
}
